{
  "id": "huntsman",
  "name": "Huntsman",
  "team": "townsfolk",
  "ability": "Once per game, at night, choose a living player: the Damsel, if chosen, becomes a not-in-play Townsfolk. [+the Damsel]",
  "firstNight": null,
  "otherNights": null,
  "reminders": [
    "Character"
  ],
  "setup": true,
  "special": null,
  "editions": [
    "experimental"
  ],
  "tags": [
    "active",
    "once-per-game",
    "setup",
    "damsel-dependent",
    "character-change"
  ],
  "wikiUrl": null,
  "imageUrl": null,
  "howToRun": "",
  "firstNightDescription": "",
  "tipsAndTricks": "",
  "bluffing": "",
  "legacy": {
    "category": "townsfolk",
    "originalSource": "experimental",
    "otherNightReminder": "If the Huntsman has not used their ability: The Huntsman either shows a 'no' head shake or points to a player. If that player is the Damsel: Replace the Damsel with a not-in-play Townsfolk token."
  },
  "actions": {
    "firstNight": [],
    "otherNights": [
      {
        "id": "huntsman-choose-player-check-damsel",
        "type": "character",
        "action": "choose-player-to-check-damsel",
        "description": "Once per game, choose a living player: the Damsel, if chosen, becomes a not-in-play Townsfolk.",
        "targets": ["huntsman"],
        "information": {
          "customMessage": "Choose a player; if Damsel, replace with not-in-play Townsfolk."
        },
        "order": 1
      }
    ],
    "day": [],
    "nominations": [],
    "voting": [],
    "execution": []
  }
}
