{
  "id": "heretic",
  "name": "Heretic",
  "team": "outsider",
  "ability": "Whoever wins, loses & whoever loses, wins, even if you are dead.",
  "firstNight": null,
  "otherNights": null,
  "reminders": [],
  "setup": false,
  "special": null,
  "editions": [
    "experimental"
  ],
  "tags": [
    "win-condition",
    "reverse-victory"
  ],
  "wikiUrl": null,
  "imageUrl": null,
  "howToRun": "",
  "firstNightDescription": "",
  "tipsAndTricks": "",
  "bluffing": "",
  "legacy": {
    "category": "outsider",
    "originalSource": "experimental"
  },
  "actions": {
    "firstNight": [],
    "otherNights": [],
    "day": [],
    "nominations": [],
    "voting": [],
    "execution": []
  }
}
