{
  "id": "organ-grinder",
  "name": "Organ Grinder",
  "team": "minion",
  "ability": "All players keep their eyes closed when voting and the vote tally is secret. Each night, choose if you are drunk until dusk.",
  "firstNight": null,
  "otherNights": null,
  "reminders": [
    "Drunk"
  ],
  "setup": false,
  "special": null,
  "editions": [
    "experimental"
  ],
  "tags": [
    "voting-modifier",
    "secret-votes",
    "self-drunk"
  ],
  "wikiUrl": null,
  "imageUrl": null,
  "howToRun": "",
  "firstNightDescription": "",
  "tipsAndTricks": "",
  "bluffing": "",
  "legacy": {
    "category": "minion",
    "originalSource": "experimental",
    "otherNightReminder": "The Organ Grinder chooses whether to be drunk until dusk."
  },
  "actions": {
    "firstNight": [],
    "otherNights": [
      {
        "id": "organ-grinder-choose-drunk",
        "type": "character",
        "action": "choose-if-drunk-until-dusk",
        "description": "Each night, choose if you are drunk until dusk.",
        "targets": ["organ-grinder"],
        "information": {
          "customMessage": "Choose if drunk until dusk."
        },
        "order": 1
      }
    ],
    "day": [],
    "nominations": [],
    "voting": [],
    "execution": []
  }
}
