{
  "id": "vortox",
  "name": "Vortox",
  "team": "demon",
  "ability": "Each night*, choose a player: they die. Townsfolk abilities yield false info. Each day, if no-one is executed, evil wins.",
  "firstNight": null,
  "otherNights": null,
  "reminders": [],
  "setup": false,
  "special": null,
  "editions": [
    "sects-and-violets"
  ],
  "tags": [
    "demon",
    "active",
    "false-information",
    "execution-requirement"
  ],
  "wikiUrl": null,
  "imageUrl": null,
  "howToRun": "",
  "firstNightDescription": "",
  "tipsAndTricks": "",
  "bluffing": "",
  "legacy": {
    "category": "demon",
    "originalSource": "sects-and-violets",
    "otherNightReminder": "The Vortox points to a player. That player dies."
  },
  "actions": {
    "firstNight": [],
    "otherNights": [
      {
        "id": "vortox-kill",
        "type": "character",
        "action": "choosePlayerKill",
        "description": "Each night*, choose a player: they die.",
        "targets": [
          "vortox"
        ],
        "order": 1
      }
    ],
    "day": [
      {
        "id": "vortox-no-execution-evil-wins",
        "type": "character",
        "action": "noExecutionEvilWins",
        "description": "Each day, if no-one is executed, evil wins.",
        "targets": [
          "vortox"
        ],
        "order": 1
      }
    ],
    "nominations": [],
    "voting": [],
    "execution": []
  }
}
