{
  "id": "town-crier",
  "name": "Town Crier",
  "team": "townsfolk",
  "ability": "Each night*, you learn if a Minion nominated today.",
  "firstNight": null,
  "otherNights": null,
  "reminders": [],
  "setup": false,
  "special": null,
  "editions": [
    "sects-and-violets"
  ],
  "tags": [
    "information",
    "nominations"
  ],
  "wikiUrl": null,
  "imageUrl": null,
  "howToRun": "",
  "firstNightDescription": "",
  "tipsAndTricks": "",
  "bluffing": "",
  "legacy": {
    "category": "townsfolk",
    "originalSource": "sects-and-violets",
    "otherNightReminder": "Nod your head or shake your head to indicate whether a Minion nominated today."
  },
  "actions": {
    "firstNight": [],
    "otherNights": [
      {
        "id": "towncrier-learn-minion-nominated",
        "type": "character",
        "action": "learnIfMinionNominatedToday",
        "description": "Each night*, learn if a Minion nominated today.",
        "targets": [
          "town-crier"
        ],
        "information": {
          "customMessage": "YES if a Minion nominated today, otherwise NO"
        },
        "order": 1
      }
    ],
    "day": [],
    "nominations": [],
    "voting": [],
    "execution": []
  }
}
